{
  "schema_version": "ci-log-summary.v1",
  "log_file": "logs/ci-run-4182.log",
  "failing_command": "bun test",
  "failure_kind": "test_failure",
  "summary": "bun test fails persistently on LruCache > updates recency on get (src/cache/lru.test.ts:58): expected \"beta\" but got \"alpha\", so get() is not refreshing recency. The ApiClient 503-retry timeout in attempt 1 is flaky — it passed on the retry — but the LruCache failure reproduced in both attempts and is the reason the pipeline is red.",
  "error_lines": [
    {
      "line": 53,
      "text": "✗ LruCache > updates recency on get [0.20ms]"
    },
    {
      "line": 54,
      "text": "  error: expect(received).toBe(expected)"
    },
    {
      "line": 55,
      "text": "  Expected: \"beta\""
    },
    {
      "line": 56,
      "text": "  Received: \"alpha\""
    },
    {
      "line": 70,
      "text": " 1 fail"
    }
  ],
  "suggested_next_commands": [
    "bun test src/cache/lru.test.ts",
    "bun test --rerun-each 5 src/cache/lru.test.ts",
    "bun test --rerun-each 5 src/api/client.test.ts"
  ]
}
