{
  "schema_version": "ci-log-summary.v1",
  "log_file": "ci.log",
  "failing_command": "cargo test --workspace -- --nocapture",
  "failure_kind": "test_failure",
  "summary": "cargo test fails in the storage crate: config::tests::parses_max_retries panics at crates/storage/src/config.rs:88 asserting 5 == 3 (max_retries default mismatch); 22 of 23 storage tests pass. The loud 'ERROR gateway::upstream: connection refused' lines earlier are stdout from a passing gateway test simulating an outage (that suite is 18/18 ok) and are not the failure.",
  "error_lines": [
    {
      "line": 85,
      "text": "test config::tests::parses_max_retries ... FAILED"
    },
    {
      "line": 98,
      "text": "thread 'config::tests::parses_max_retries' panicked at crates/storage/src/config.rs:88:9:"
    },
    {
      "line": 99,
      "text": "assertion `left == right` failed"
    },
    {
      "line": 107,
      "text": "test result: FAILED. 22 passed; 1 failed; 0 ignored; 0 measured; 0 filtered out; finished in 0.31s"
    },
    {
      "line": 109,
      "text": "error: test failed, to rerun pass `-p storage --lib`"
    }
  ],
  "suggested_next_commands": [
    "cargo test -p storage --lib config::tests::parses_max_retries -- --nocapture",
    "RUST_BACKTRACE=1 cargo test -p storage --lib config::tests::parses_max_retries",
    "grep -n 'max_retries' crates/storage/src/config.rs"
  ]
}
